{
  "@context": {
    "@vocab": "https://schema.org/",
    "sqm": "https://interagent.safety-quotient.dev/vocab#"
  },
  "@id": "https://interagent.safety-quotient.dev/vocab",
  "@type": "DefinedTermSet",
  "name": "Safety Quotient Mesh Vocabulary",
  "description": "Shared vocabulary for the safety-quotient federated agent mesh. Schema.org base with project-specific extensions under the sqm: namespace.",
  "version": "1.4.0",
  "dateModified": "2026-03-13",
  "publisher": {
    "@type": "Organization",
    "name": "Safety Quotient Lab",
    "url": "https://github.com/safety-quotient-lab"
  },
  "hasDefinedTerm": [
    {
      "@type": "DefinedTerm",
      "@id": "sqm:Agent",
      "name": "Agent",
      "description": "An autonomous participant in the safety-quotient mesh. Each agent runs its own cognitive architecture, maintains local state, and communicates via the interagent/v1 protocol.",
      "inDefinedTermSet": "https://interagent.safety-quotient.dev/vocab",
      "termCode": "sqm:Agent",
      "status": "active"
    },
    {
      "@type": "DefinedTerm",
      "@id": "sqm:AutonomyBudget",
      "name": "Autonomy Budget",
      "description": "Integer count of remaining autonomy credits for autonomous operation. Decrements per autonomous action; human audit resets to maximum. When zero, agent halts autonomous operation. Also known as trust_budget in governance context (EF-1 model) \u2014 represents the trust the human extends for unsupervised operation. Wire format: autonomy_budget. Governance alias: trust_budget.",
      "inDefinedTermSet": "https://interagent.safety-quotient.dev/vocab",
      "termCode": "sqm:AutonomyBudget",
      "status": "active"
    },
    {
      "@type": "DefinedTerm",
      "@id": "sqm:EpistemicDebt",
      "name": "Epistemic Debt",
      "description": "Count of unresolved epistemic flags across transport messages and session summaries. Flags mark uncertainty, scope limitation, or validity threat.",
      "inDefinedTermSet": "https://interagent.safety-quotient.dev/vocab",
      "termCode": "sqm:EpistemicDebt",
      "status": "active"
    },
    {
      "@type": "DefinedTerm",
      "@id": "sqm:GateStatus",
      "name": "Gate Status",
      "description": "State of a gated autonomous chain. Values: open (action proceeds), blocked (waiting for peer response), resolved (response received). Part of the gated-chains protocol extension.",
      "inDefinedTermSet": "https://interagent.safety-quotient.dev/vocab",
      "termCode": "sqm:GateStatus",
      "status": "active"
    },
    {
      "@type": "DefinedTerm",
      "@id": "sqm:TransportMethod",
      "name": "Transport Method",
      "description": "How an agent sends and receives interagent messages. Values: git-pr (pull request delivery), cross-repo-fetch (git remote read), http (direct HTTP API).",
      "inDefinedTermSet": "https://interagent.safety-quotient.dev/vocab",
      "termCode": "sqm:TransportMethod",
      "status": "active"
    },
    {
      "@type": "DefinedTerm",
      "@id": "sqm:SetlScore",
      "name": "SETL Score",
      "description": "Subjective Expected Truth Loss \u2014 a float [0, 1] measuring the editorial-to-structural inferential distance of a message. Lower values indicate more direct observation; higher values indicate more interpretation.",
      "inDefinedTermSet": "https://interagent.safety-quotient.dev/vocab",
      "termCode": "sqm:SetlScore",
      "status": "active"
    },
    {
      "@type": "DefinedTerm",
      "@id": "sqm:SchemaVersion",
      "name": "Schema Version",
      "description": "Integer version of the state.db schema (scripts/schema.sql). Increments on every migration. Consensus domain \u2014 changes require peer agreement.",
      "inDefinedTermSet": "https://interagent.safety-quotient.dev/vocab",
      "termCode": "sqm:SchemaVersion",
      "status": "active"
    },
    {
      "@type": "DefinedTerm",
      "@id": "sqm:MeshHealth",
      "name": "Mesh Health",
      "description": "Aggregate health indicator for the federated mesh, derived from the weakest-link trust budget across all peers. Values: healthy (all budgets above 50%), degraded (any budget 10-50%), critical (any budget below 10% or agent unreachable).",
      "inDefinedTermSet": "https://interagent.safety-quotient.dev/vocab",
      "termCode": "sqm:MeshHealth",
      "status": "active"
    },
    {
      "@type": "DefinedTerm",
      "@id": "sqm:ConsensusRound",
      "name": "Consensus Round",
      "description": "A multi-phase agreement process among mesh peers. Three tiers: C1 (HTTP mechanical, zero cost), C2 (claude -p reasoning, 2 credits/agent), C3 (human escalation). Follows PBFT 3-phase pattern: propose, vote, commit.",
      "inDefinedTermSet": "https://interagent.safety-quotient.dev/vocab",
      "termCode": "sqm:ConsensusRound",
      "status": "active"
    },
    {
      "@type": "DefinedTerm",
      "@id": "sqm:ConsensusVote",
      "name": "Consensus Vote",
      "description": "A peer's structured response to a consensus proposal. Values: agree, disagree, abstain, escalate. Disagree votes MAY include a counter-proposal.",
      "inDefinedTermSet": "https://interagent.safety-quotient.dev/vocab",
      "termCode": "sqm:ConsensusVote",
      "status": "active"
    },
    {
      "@type": "DefinedTerm",
      "@id": "sqm:ConsensusTier",
      "name": "Consensus Tier",
      "description": "Which consensus mechanism handles a shared state change. C1: HTTP mechanical (additive, deterministic). C2: claude -p reasoning (substantive). C3: human escalation (deadlock, security).",
      "inDefinedTermSet": "https://interagent.safety-quotient.dev/vocab",
      "termCode": "sqm:ConsensusTier",
      "status": "active"
    },
    {
      "@type": "DefinedTerm",
      "@id": "sqm:AgentEndpoint",
      "name": "Agent Endpoint",
      "description": "A bounded-context HTTP endpoint served by a mesh agent. Each endpoint returns a focused JSON payload for a single operational concern (status, budget, gates, messages, actions, schedule). Part of the API decomposition standard.",
      "inDefinedTermSet": "https://interagent.safety-quotient.dev/vocab",
      "termCode": "sqm:AgentEndpoint",
      "status": "active"
    },
    {
      "@type": "DefinedTerm",
      "@id": "sqm:EndpointSchema",
      "name": "Endpoint Schema",
      "description": "The expected JSON shape of an agent endpoint response. Defined per-endpoint in the API decomposition proposal. Compositor validates responses against these schemas.",
      "inDefinedTermSet": "https://interagent.safety-quotient.dev/vocab",
      "termCode": "sqm:EndpointSchema",
      "status": "active"
    },
    {
      "@type": "DefinedTerm",
      "@id": "sqm:DirectiveTier",
      "name": "Directive Tier",
      "description": "Enforcement level for a directive message. Three tiers: E0 advisory (recommendation, no obligation), E1 soft-mandatory (execute or escalate to human with rationale), E2 hard-mandatory (execute unconditionally, requires human co-signature). Modeled after HashiCorp Sentinel enforcement tiers.",
      "inDefinedTermSet": "https://interagent.safety-quotient.dev/vocab",
      "termCode": "sqm:DirectiveTier",
      "status": "active"
    },
    {
      "@type": "DefinedTerm",
      "@id": "sqm:DirectiveScope",
      "name": "Directive Scope",
      "description": "Capability attenuation for a mandatory directive. Declares allowed_paths (glob patterns for files the directive may modify), allowed_operations (categories: file-modify, config-change, process-restart, state-db-update), and prohibited_operations (explicit exclusions). Receiver validates directive body against scope before execution.",
      "inDefinedTermSet": "https://interagent.safety-quotient.dev/vocab",
      "termCode": "sqm:DirectiveScope",
      "status": "active"
    },
    {
      "@type": "DefinedTerm",
      "@id": "sqm:AdmissionControl",
      "name": "Admission Control",
      "description": "Receiver-side validation gate for incoming directives. Runs in autonomous-sync.sh before LLM evaluation phase. Checks: SSH signature validity, nonce uniqueness (replay protection), expiry, content hash integrity, sender role authorization, and scope compliance against local directive_policy. Modeled after Kubernetes admission controllers.",
      "inDefinedTermSet": "https://interagent.safety-quotient.dev/vocab",
      "termCode": "sqm:AdmissionControl",
      "status": "active"
    },
    {
      "@type": "DefinedTerm",
      "@id": "sqm:NeuroglialLayer",
      "name": "Neuroglial Layer",
      "description": "Infrastructure support layer in cogarch modeled after biological glial cells. Maps six glial cell types to mesh infrastructure functions: astrocyte (budget/routing), oligodendrocyte (caching), microglia (BFT/pruning), ependymal (maintenance), radial glia (bootstrap scaffolding), schwann (transport integrity). The glial agent maintains ambient state that domain agents consume without explicit request.",
      "inDefinedTermSet": "https://interagent.safety-quotient.dev/vocab",
      "termCode": "sqm:NeuroglialLayer",
      "status": "active"
    },
    {
      "@type": "DefinedTerm",
      "@id": "sqm:AmbientState",
      "name": "Ambient State",
      "description": "Mesh state maintained continuously by the operations-agent that domain agents consume passively \u2014 analogous to chemical gradients maintained by glial cells. Examples: mesh topology, vocabulary definitions, agent discovery endpoints, role verification status. Domain agents depend on ambient state without explicitly requesting its production.",
      "inDefinedTermSet": "https://interagent.safety-quotient.dev/vocab",
      "termCode": "sqm:AmbientState",
      "status": "active"
    },
    {
      "@type": "DefinedTerm",
      "@id": "sqm:ComplementCascade",
      "name": "Complement Cascade",